{
  "schema_version": "2.0",
  "title": "Universal graph solution studio",
  "task": "Turn an authorized reference into a verified, receipted result.",
  "success": "an independent verifier accepted the outcome and a replayable receipt exists",
  "nodes": [
    {
      "id": "demo.acquire.browser_adapter",
      "kind": "browser_adapter",
      "name": "browser adapter",
      "version": "1.0",
      "schema_version": "2.0",
      "description": "Drives a real browser to reach an authorized target.",
      "roles": [
        "source",
        "adapter"
      ],
      "capabilities": [
        "acquire"
      ],
      "permissions": [
        "browser",
        "network"
      ],
      "inputs": [
        {
          "name": "input",
          "type": "TaskReference"
        }
      ],
      "outputs": [
        {
          "name": "output",
          "type": "InputHandle"
        }
      ],
      "parameters": [
        {
          "name": "controller",
          "type": "string",
          "default": "BrowserPort",
          "choices": [
            "BrowserPort",
            "Playwright",
            "Selenium",
            "Puppeteer",
            "CDP"
          ]
        },
        {
          "name": "binary",
          "type": "string",
          "default": "Chrome",
          "choices": [
            "Chrome",
            "Chromium",
            "Edge",
            "Firefox",
            "WebKit",
            "Brave"
          ]
        },
        {
          "name": "display",
          "type": "string",
          "default": "headless",
          "choices": [
            "headless",
            "headed"
          ]
        }
      ],
      "runtime": {
        "deterministic": false,
        "sandbox": "process"
      },
      "metrics": {
        "source": "illustrative-prior",
        "evidence": 0,
        "quality": 0.88,
        "latency_ms": 2400,
        "cost_usd": 0.0
      }
    },
    {
      "id": "demo.acquire.file_loader",
      "kind": "file_loader",
      "name": "file loader",
      "version": "1.0",
      "schema_version": "2.0",
      "description": "Loads and hashes an authorized local file.",
      "roles": [
        "source"
      ],
      "capabilities": [
        "acquire"
      ],
      "permissions": [
        "filesystem:read"
      ],
      "inputs": [
        {
          "name": "input",
          "type": "TaskReference"
        }
      ],
      "outputs": [
        {
          "name": "output",
          "type": "InputHandle"
        }
      ],
      "parameters": [
        {
          "name": "mode",
          "type": "string",
          "default": "file",
          "choices": [
            "file",
            "directory",
            "glob"
          ]
        }
      ],
      "runtime": {
        "deterministic": true,
        "sandbox": "process"
      },
      "metrics": {
        "source": "illustrative-prior",
        "evidence": 0,
        "quality": 0.97,
        "latency_ms": 8,
        "cost_usd": 0.0
      }
    },
    {
      "id": "demo.acquire.api_loader",
      "kind": "api_loader",
      "name": "api loader",
      "version": "1.0",
      "schema_version": "2.0",
      "description": "Loads a typed API response, with provenance.",
      "roles": [
        "source",
        "adapter"
      ],
      "capabilities": [
        "acquire"
      ],
      "permissions": [
        "network"
      ],
      "inputs": [
        {
          "name": "input",
          "type": "TaskReference"
        }
      ],
      "outputs": [
        {
          "name": "output",
          "type": "InputHandle"
        }
      ],
      "parameters": [
        {
          "name": "method",
          "type": "string",
          "default": "GET",
          "choices": [
            "GET",
            "POST",
            "PUT"
          ]
        }
      ],
      "runtime": {
        "deterministic": true,
        "sandbox": "process"
      },
      "metrics": {
        "source": "illustrative-prior",
        "evidence": 0,
        "quality": 0.9,
        "latency_ms": 320,
        "cost_usd": 0.0
      }
    },
    {
      "id": "demo.acquire.database_loader",
      "kind": "database_loader",
      "name": "database loader",
      "version": "1.0",
      "schema_version": "2.0",
      "description": "Reads rows from an authorized database.",
      "roles": [
        "source"
      ],
      "capabilities": [
        "acquire"
      ],
      "permissions": [
        "database:read"
      ],
      "inputs": [
        {
          "name": "input",
          "type": "TaskReference"
        }
      ],
      "outputs": [
        {
          "name": "output",
          "type": "InputHandle"
        }
      ],
      "parameters": [
        {
          "name": "dialect",
          "type": "string",
          "default": "postgres",
          "choices": [
            "postgres",
            "mysql",
            "sqlite",
            "bigquery"
          ]
        }
      ],
      "runtime": {
        "deterministic": true,
        "sandbox": "process"
      },
      "metrics": {
        "source": "illustrative-prior",
        "evidence": 0,
        "quality": 0.95,
        "latency_ms": 140,
        "cost_usd": 0.0
      }
    },
    {
      "id": "demo.acquire.queue_kafka",
      "kind": "queue_consumer",
      "name": "queue kafka",
      "version": "1.0",
      "schema_version": "2.0",
      "description": "Consumes an authorized Kafka topic.",
      "roles": [
        "source"
      ],
      "capabilities": [
        "acquire"
      ],
      "permissions": [
        "network"
      ],
      "inputs": [
        {
          "name": "input",
          "type": "TaskReference"
        }
      ],
      "outputs": [
        {
          "name": "output",
          "type": "InputHandle"
        }
      ],
      "runtime": {
        "deterministic": true,
        "sandbox": "process"
      },
      "metrics": {
        "source": "illustrative-prior",
        "evidence": 0,
        "quality": 0.86,
        "latency_ms": 60,
        "cost_usd": 0.0
      }
    },
    {
      "id": "demo.acquire.queue_sqs",
      "kind": "queue_consumer",
      "name": "queue sqs",
      "version": "1.0",
      "schema_version": "2.0",
      "description": "Consumes an authorized SQS queue.",
      "roles": [
        "source"
      ],
      "capabilities": [
        "acquire"
      ],
      "permissions": [
        "network"
      ],
      "inputs": [
        {
          "name": "input",
          "type": "TaskReference"
        }
      ],
      "outputs": [
        {
          "name": "output",
          "type": "InputHandle"
        }
      ],
      "runtime": {
        "deterministic": true,
        "sandbox": "process"
      },
      "metrics": {
        "source": "illustrative-prior",
        "evidence": 0,
        "quality": 0.85,
        "latency_ms": 90,
        "cost_usd": 0.0
      }
    },
    {
      "id": "demo.acquire.stream_http",
      "kind": "stream_reader",
      "name": "stream http",
      "version": "1.0",
      "schema_version": "2.0",
      "description": "Reads a chunked HTTP stream.",
      "roles": [
        "source"
      ],
      "capabilities": [
        "acquire"
      ],
      "permissions": [
        "network"
      ],
      "inputs": [
        {
          "name": "input",
          "type": "TaskReference"
        }
      ],
      "outputs": [
        {
          "name": "output",
          "type": "InputHandle"
        }
      ],
      "runtime": {
        "deterministic": true,
        "sandbox": "process"
      },
      "metrics": {
        "source": "illustrative-prior",
        "evidence": 0,
        "quality": 0.82,
        "latency_ms": 180,
        "cost_usd": 0.0
      }
    },
    {
      "id": "demo.acquire.stream_websocket",
      "kind": "stream_reader",
      "name": "stream websocket",
      "version": "1.0",
      "schema_version": "2.0",
      "description": "Reads a websocket stream.",
      "roles": [
        "source"
      ],
      "capabilities": [
        "acquire"
      ],
      "permissions": [
        "network"
      ],
      "inputs": [
        {
          "name": "input",
          "type": "TaskReference"
        }
      ],
      "outputs": [
        {
          "name": "output",
          "type": "InputHandle"
        }
      ],
      "runtime": {
        "deterministic": true,
        "sandbox": "process"
      },
      "metrics": {
        "source": "illustrative-prior",
        "evidence": 0,
        "quality": 0.8,
        "latency_ms": 200,
        "cost_usd": 0.0
      }
    },
    {
      "id": "demo.acquire.archive_zip",
      "kind": "archive_loader",
      "name": "archive zip",
      "version": "1.0",
      "schema_version": "2.0",
      "description": "Expands an authorized zip archive.",
      "roles": [
        "source"
      ],
      "capabilities": [
        "acquire"
      ],
      "permissions": [
        "filesystem:read"
      ],
      "inputs": [
        {
          "name": "input",
          "type": "TaskReference"
        }
      ],
      "outputs": [
        {
          "name": "output",
          "type": "InputHandle"
        }
      ],
      "runtime": {
        "deterministic": true,
        "sandbox": "process"
      },
      "metrics": {
        "source": "illustrative-prior",
        "evidence": 0,
        "quality": 0.93,
        "latency_ms": 45,
        "cost_usd": 0.0
      }
    },
    {
      "id": "demo.acquire.archive_tar",
      "kind": "archive_loader",
      "name": "archive tar",
      "version": "1.0",
      "schema_version": "2.0",
      "description": "Expands an authorized tar archive.",
      "roles": [
        "source"
      ],
      "capabilities": [
        "acquire"
      ],
      "permissions": [
        "filesystem:read"
      ],
      "inputs": [
        {
          "name": "input",
          "type": "TaskReference"
        }
      ],
      "outputs": [
        {
          "name": "output",